{
  "$schema": "https://json-schema.org/draft/2020-12/schema",
  "$id": "https://schemas.vlatam.local/controlled-live-arca-kill-switch.schema.json",
  "title": "Controlled live ARCA kill switch",
  "type": "object",
  "additionalProperties": false,
  "required": [
    "schema_version",
    "kill_switch_id",
    "kill_switch_sha256",
    "state",
    "reviewed_artifact_id",
    "reviewed_by",
    "reviewed_at",
    "reason",
    "live_execution_blocked"
  ],
  "properties": {
    "schema_version": { "const": "1.0.0" },
    "kill_switch_id": { "const": "controlled-live-arca-run" },
    "kill_switch_sha256": { "type": "string", "pattern": "^[a-f0-9]{64}$" },
    "state": { "enum": ["active", "disabled"] },
    "reviewed_artifact_id": { "type": "string", "minLength": 1 },
    "reviewed_by": {
      "type": "string",
      "pattern": "^human:[a-z0-9][a-z0-9._@-]*$"
    },
    "reviewed_at": {
      "type": "string",
      "pattern": "^[0-9]{4}-[0-9]{2}-[0-9]{2}T[0-9]{2}:[0-9]{2}:[0-9]{2}\\.[0-9]{3}Z$"
    },
    "reason": { "type": "string", "minLength": 1 },
    "live_execution_blocked": { "type": "boolean" }
  }
}
